[
  {
    "schema_version": "1.0.0",
    "id": "cue_tag_h09",
    "t_start": 2331.0,
    "t_end": 2336.0,
    "priority": 30,
    "anchor": {
      "kind": "player",
      "player": "H09",
      "region": null,
      "pitch_xy": null
    },
    "payload": {
      "type": "name_tag",
      "player": "H09",
      "emphasis": "highlight"
    },
    "modes": [
      "analyst",
      "casual"
    ],
    "team_focus": null,
    "evidence": []
  },
  {
    "schema_version": "1.0.0",
    "id": "cue_badge_h09",
    "t_start": 2333.0,
    "t_end": 2337.0,
    "priority": 60,
    "anchor": {
      "kind": "player",
      "player": "H09",
      "region": null,
      "pitch_xy": null
    },
    "payload": {
      "type": "threshold_badge",
      "player": "H09",
      "metric": "top_speed",
      "value": 32.8,
      "unit": "km/h",
      "threshold": 32.0,
      "record": true
    },
    "modes": [
      "analyst",
      "casual"
    ],
    "team_focus": null,
    "evidence": []
  },
  {
    "schema_version": "1.0.0",
    "id": "cue_pass_004209",
    "t_start": 2334.1,
    "t_end": 2339.0,
    "priority": 70,
    "anchor": {
      "kind": "screen",
      "player": null,
      "region": "bottom_left",
      "pitch_xy": null
    },
    "payload": {
      "type": "pass_card",
      "event_id": "ev_004209",
      "passer": "H10",
      "recipient": "H09",
      "length_m": 22.41,
      "ball_speed_kmh": 61.9,
      "xpass": 0.58,
      "difficulty": 5,
      "technique": "curled",
      "pass_type": "through_ball",
      "outcome": "complete"
    },
    "modes": [
      "analyst",
      "casual"
    ],
    "team_focus": null,
    "evidence": []
  },
  {
    "schema_version": "1.0.0",
    "id": "cue_shot_004211",
    "t_start": 2335.0,
    "t_end": 2341.0,
    "priority": 80,
    "anchor": {
      "kind": "screen",
      "player": null,
      "region": "lower_third",
      "pitch_xy": null
    },
    "payload": {
      "type": "shot_card",
      "event_id": "ev_004211",
      "shooter": "H09",
      "xg": 0.31,
      "psxg": 0.42,
      "ball_speed_kmh": 86.8,
      "distance_m": 13.78,
      "technique": "placed",
      "outcome": "saved"
    },
    "modes": [
      "analyst",
      "casual"
    ],
    "team_focus": null,
    "evidence": [
      "ev_004211"
    ]
  },
  {
    "schema_version": "1.0.0",
    "id": "cue_momentum",
    "t_start": 2340.0,
    "t_end": 2352.0,
    "priority": 40,
    "anchor": {
      "kind": "screen",
      "player": null,
      "region": "top_right",
      "pitch_xy": null
    },
    "payload": {
      "type": "momentum_chart",
      "home": [
        {
          "t": 2300.0,
          "value": 0.1
        },
        {
          "t": 2330.0,
          "value": 0.4
        }
      ],
      "away": [
        {
          "t": 2300.0,
          "value": 0.3
        }
      ],
      "window_s": 300.0
    },
    "modes": [
      "analyst",
      "casual"
    ],
    "team_focus": null,
    "evidence": []
  },
  {
    "schema_version": "1.0.0",
    "id": "cue_chaos",
    "t_start": 2340.0,
    "t_end": 2352.0,
    "priority": 40,
    "anchor": {
      "kind": "screen",
      "player": null,
      "region": "top_left",
      "pitch_xy": null
    },
    "payload": {
      "type": "control_chaos",
      "index": 0.42,
      "series": [
        {
          "t": 2300.0,
          "value": 0.1
        },
        {
          "t": 2330.0,
          "value": 0.4
        }
      ],
      "drivers": {
        "turnover_rate": 0.4,
        "pressure": 0.3
      }
    },
    "modes": [
      "analyst",
      "casual"
    ],
    "team_focus": null,
    "evidence": []
  },
  {
    "schema_version": "1.0.0",
    "id": "cue_accuracy",
    "t_start": 2200.0,
    "t_end": 2400.0,
    "priority": 20,
    "anchor": {
      "kind": "screen",
      "player": null,
      "region": "bottom_right",
      "pitch_xy": null
    },
    "payload": {
      "type": "accuracy_panel",
      "rows": [
        {
          "event_type": "pass",
          "qualifier": null,
          "metric": "detection",
          "precision": 0.94,
          "recall": 0.91,
          "f1": 0.925,
          "mae": null,
          "unit": null,
          "support": 412
        },
        {
          "event_type": "pass",
          "qualifier": "pass.height=high",
          "metric": "detection",
          "precision": 0.8,
          "recall": 0.72,
          "f1": 0.758,
          "mae": null,
          "unit": null,
          "support": 38
        },
        {
          "event_type": null,
          "qualifier": "ball_speed",
          "metric": "mae",
          "precision": null,
          "recall": null,
          "f1": null,
          "mae": 3.1,
          "unit": "km/h",
          "support": 1200
        }
      ],
      "window": "match_so_far"
    },
    "modes": [
      "analyst",
      "casual"
    ],
    "team_focus": null,
    "evidence": []
  },
  {
    "schema_version": "1.0.0",
    "id": "cue_rewind_017",
    "t_start": 2336.5,
    "t_end": 2346.5,
    "priority": 90,
    "anchor": {
      "kind": "screen",
      "player": null,
      "region": "center",
      "pitch_xy": null
    },
    "payload": {
      "type": "rewind_prompt",
      "moment_id": "mom_017",
      "narrative_id": "nar_0411_en_casual"
    },
    "modes": [
      "analyst",
      "casual"
    ],
    "team_focus": null,
    "evidence": []
  },
  {
    "schema_version": "1.0.0",
    "id": "cue_caption_0412",
    "t_start": 2335.5,
    "t_end": 2342.0,
    "priority": 50,
    "anchor": {
      "kind": "screen",
      "player": null,
      "region": "lower_third",
      "pitch_xy": null
    },
    "payload": {
      "type": "caption",
      "narrative_id": "nar_0412_es_casual",
      "speak": true
    },
    "modes": [
      "analyst",
      "casual"
    ],
    "team_focus": null,
    "evidence": []
  },
  {
    "schema_version": "1.0.0",
    "id": "cue_milestone",
    "t_start": 2336.0,
    "t_end": 2341.0,
    "priority": 55,
    "anchor": {
      "kind": "screen",
      "player": null,
      "region": "top_center",
      "pitch_xy": null
    },
    "payload": {
      "type": "milestone",
      "narrative_id": "nar_0413_en_analyst",
      "milestone": "first_shot_on_target",
      "team": "home",
      "player": "H09"
    },
    "modes": [
      "analyst",
      "casual"
    ],
    "team_focus": null,
    "evidence": []
  },
  {
    "schema_version": "1.0.0",
    "id": "cue_highlight",
    "t_start": 2332.4,
    "t_end": 2334.1,
    "priority": 65,
    "anchor": {
      "kind": "pitch",
      "player": null,
      "region": null,
      "pitch_xy": [
        38.6,
        -3.6
      ]
    },
    "payload": {
      "type": "highlight",
      "players": [
        "H09",
        "A04"
      ],
      "style": "trail"
    },
    "modes": [
      "analyst",
      "casual"
    ],
    "team_focus": null,
    "evidence": []
  }
]
